{
  "$schema": "https://json-schema.org/draft/2020-12/schema",
  "type": "object",
  "required": [
    "schema_version",
    "kind",
    "approval_id",
    "git_commit",
    "product_version",
    "candidate_identity_sha256",
    "expires_at",
    "advertiser_hash",
    "max_objects",
    "max_spend",
    "commands",
    "endpoints",
    "stop_owner",
    "approvals"
  ],
  "properties": {
    "schema_version": {"const": 1},
    "kind": {"const": "ac127_write_canary"},
    "approval_id": {
      "type": "string",
      "pattern": "^[A-Za-z0-9][A-Za-z0-9._:-]{7,127}$"
    },
    "git_commit": {
      "type": "string",
      "pattern": "^[a-f0-9]{40}$",
      "not": {"const": "0000000000000000000000000000000000000000"}
    },
    "product_version": {
      "type": "string",
      "pattern": "^[0-9]+\\.[0-9]+\\.[0-9]+$"
    },
    "candidate_identity_sha256": {
      "type": "string",
      "pattern": "^[a-f0-9]{64}$",
      "not": {
        "const": "0000000000000000000000000000000000000000000000000000000000000000"
      }
    },
    "expires_at": {"type": "string", "format": "date-time"},
    "advertiser_hash": {
      "type": "string",
      "pattern": "^[a-f0-9]{64}$",
      "not": {
        "const": "0000000000000000000000000000000000000000000000000000000000000000"
      }
    },
    "max_objects": {"const": 1},
    "max_spend": {"const": 0},
    "commands": {
      "type": "array",
      "minItems": 1,
      "uniqueItems": true,
      "items": {"type": "string", "minLength": 1}
    },
    "endpoints": {
      "type": "array",
      "minItems": 1,
      "uniqueItems": true,
      "items": {"type": "string", "pattern": "^/v[0-9]"}
    },
    "stop_owner": {"type": "string", "minLength": 1},
    "approvals": {
      "type": "array",
      "minItems": 2,
      "maxItems": 2,
      "items": {
        "type": "object",
        "required": ["role", "approver", "decision", "approved_at"],
        "properties": {
          "role": {"enum": ["MT", "SO"]},
          "approver": {"type": "string"},
          "decision": {"enum": ["pending", "approved", "rejected"]},
          "approved_at": {"type": ["string", "null"], "format": "date-time"},
          "notes": {"type": "string"}
        },
        "additionalProperties": false
      }
    }
  },
  "additionalProperties": false
}
